{
  "id": "upgrade.storm.long_arc",
  "displayName": "Long Arc",
  "description": "Chain lightning jumps to one more enemy, and further.",
  "hero": "hero.storm",
  "cost": 100,
  "modifiers": [
    {
      "path": "chain.maxTargets",
      "op": "add",
      "value": 1
    },
    {
      "path": "chain.jumpRadius",
      "op": "mul",
      "value": 1.3
    }
  ],
  "requires": {
    "flags": [
      "world1Done"
    ]
  }
}
