{
  "id": "upgrade.swinger.quick_recharge",
  "displayName": "Quick Recharge",
  "description": "Energy comes back sooner and faster.",
  "hero": "hero.swinger",
  "cost": 60,
  "modifiers": [
    {
      "path": "energy.regenPerSecond",
      "op": "mul",
      "value": 1.3
    },
    {
      "path": "energy.regenDelay",
      "op": "mul",
      "value": 0.7
    }
  ],
  "requires": {
    "level": 2
  }
}
