{
  "id": "upgrade.flyer.capacitors",
  "displayName": "Capacitors",
  "description": "Energy refills faster and starts sooner.",
  "hero": "hero.flyer",
  "cost": 100,
  "modifiers": [
    {
      "path": "energy.regenPerSecond",
      "op": "mul",
      "value": 1.25
    },
    {
      "path": "energy.regenDelay",
      "op": "mul",
      "value": 0.7
    }
  ],
  "requires": {
    "flags": [
      "world3Done"
    ]
  }
}
